volume_name,title,authors,year,pdf_link,url
Proceedings of the 58th Annual Meeting of the Association for Computational Linguistics: Student Research Workshop,Building a J,"Tanaka, Yu, Murawaki, Yugo, Kawahara, Daisuke, Kurohashi, Sadao",2020,https://aclanthology.org/2020.acl-srw.31.pdf,https://aclanthology.org/2020.acl-srw.31
Proceedings of the 58th Annual Meeting of the Association for Computational Linguistics: Student Research Workshop,Preventing Critical Scoring Errors in Short Answer Scoring with Confidence Estimation,"Funayama, Hiroaki, Sasaki, Shota, Matsubayashi, Yuichiroh, Mizumoto, Tomoya, Suzuki, Jun, Mita, Masato, Inui, Kentaro",2020,https://aclanthology.org/2020.acl-srw.32.pdf,https://aclanthology.org/2020.acl-srw.32
Proceedings of the 58th Annual Meeting of the Association for Computational Linguistics: Student Research Workshop,How much complexity does an RNN,"Bhatt, Gantavya, Bansal, Hritik, Singh, Rishubh, Agarwal, Sumeet",2020,https://aclanthology.org/2020.acl-srw.33.pdf,https://aclanthology.org/2020.acl-srw.33
Proceedings of the 58th Annual Meeting of the Association for Computational Linguistics: Student Research Workshop,Unsupervised Multilingual Sentence Embeddings for Parallel Corpus Mining,"Kvapil{\'i}kov{\'a}, Ivana, Artetxe, Mikel, Labaka, Gorka, Agirre, Eneko, Bojar, Ond{\v{r}}ej",2020,https://aclanthology.org/2020.acl-srw.34.pdf,https://aclanthology.org/2020.acl-srw.34
Proceedings of the 58th Annual Meeting of the Association for Computational Linguistics: Student Research Workshop,Logical Inferences with Comparatives and Generalized Quantifiers,"Haruta, Izumi, Mineshima, Koji, Bekki, Daisuke",2020,https://aclanthology.org/2020.acl-srw.35.pdf,https://aclanthology.org/2020.acl-srw.35
Proceedings of the 58th Annual Meeting of the Association for Computational Linguistics: Student Research Workshop,Enhancing Word Embeddings with Knowledge Extracted from Lexical Resources,"Biesialska, Magdalena, Rafieian, Bardia, Costa-juss{\`a}, Marta R.",2020,https://aclanthology.org/2020.acl-srw.36.pdf,https://aclanthology.org/2020.acl-srw.36
Proceedings of the 58th Annual Meeting of the Association for Computational Linguistics: Student Research Workshop,Pre-training via Leveraging Assisting Languages for Neural Machine Translation,"Song, Haiyue, Dabre, Raj, Mao, Zhuoyuan, Cheng, Fei, Kurohashi, Sadao, Sumita, Eiichiro",2020,https://aclanthology.org/2020.acl-srw.37.pdf,https://aclanthology.org/2020.acl-srw.37
Proceedings of the 58th Annual Meeting of the Association for Computational Linguistics: Student Research Workshop,Checkpoint Reranking: An Approach to Select Better Hypothesis for Neural Machine Translation Systems,"Pandramish, Vinay, Sharma, Dipti Misra",2020,https://aclanthology.org/2020.acl-srw.38.pdf,https://aclanthology.org/2020.acl-srw.38
Proceedings of the 58th Annual Meeting of the Association for Computational Linguistics: Student Research Workshop,Cross-Lingual Disaster-related Multi-label Tweet Classification with Manifold Mixup,"Ray Chowdhury, Jishnu, Caragea, Cornelia, Caragea, Doina",2020,https://aclanthology.org/2020.acl-srw.39.pdf,https://aclanthology.org/2020.acl-srw.39
Proceedings of the 58th Annual Meeting of the Association for Computational Linguistics: Student Research Workshop,Inducing Grammar from Long Short-Term Memory Networks by Shapley Decomposition,"Zhang, Yuhui, Nie, Allen",2020,https://aclanthology.org/2020.acl-srw.40.pdf,https://aclanthology.org/2020.acl-srw.40
Proceedings of the 58th Annual Meeting of the Association for Computational Linguistics: Student Research Workshop,Exploring the Role of Context to Distinguish Rhetorical and Information-Seeking Questions,"Zhuang, Yuan, Riloff, Ellen",2020,https://aclanthology.org/2020.acl-srw.41.pdf,https://aclanthology.org/2020.acl-srw.41
Proceedings of the 58th Annual Meeting of the Association for Computational Linguistics: Student Research Workshop,Compositional Generalization by Factorizing Alignment and Translation,"Russin, Jacob, Jo, Jason, O{'}Reilly, Randall, Bengio, Yoshua",2020,https://aclanthology.org/2020.acl-srw.42.pdf,https://aclanthology.org/2020.acl-srw.42
Proceedings of the 58th Annual Meeting of the Association for Computational Linguistics: Student Research Workshop,\#,"Suvarna, Ashima, Bhalla, Grusha",2020,https://aclanthology.org/2020.acl-srw.43.pdf,https://aclanthology.org/2020.acl-srw.43
Volume Name Not Found,Proceedings of the 58th Annual Meeting of the Association for Computational Linguistics: Tutorial Abstracts,Authors Not Found,2020,https://aclanthology.org/2020.acl-tutorials.0.pdf,https://aclanthology.org/2020.acl-tutorials.0
Proceedings of the 58th Annual Meeting of the Association for Computational Linguistics: Tutorial Abstracts,Interpretability and Analysis in Neural NLP,"Belinkov, Yonatan, Gehrmann, Sebastian, Pavlick, Ellie",2020,https://aclanthology.org/2020.acl-tutorials.1.pdf,https://aclanthology.org/2020.acl-tutorials.1
Proceedings of the 58th Annual Meeting of the Association for Computational Linguistics: Tutorial Abstracts,Integrating Ethics into the NLP,"Bender, Emily M., Hovy, Dirk, Schofield, Alexandra",2020,https://aclanthology.org/2020.acl-tutorials.2.pdf,https://aclanthology.org/2020.acl-tutorials.2
Proceedings of the 58th Annual Meeting of the Association for Computational Linguistics: Tutorial Abstracts,Achieving Common Ground in Multi-modal Dialogue,"Alikhani, Malihe, Stone, Matthew",2020,https://aclanthology.org/2020.acl-tutorials.3.pdf,https://aclanthology.org/2020.acl-tutorials.3
Proceedings of the 58th Annual Meeting of the Association for Computational Linguistics: Tutorial Abstracts,Reviewing Natural Language Processing Research,Authors Not Found,2020,https://aclanthology.org/2020.acl-tutorials.4.pdf,https://aclanthology.org/2020.acl-tutorials.4
Proceedings of the 58th Annual Meeting of the Association for Computational Linguistics: Tutorial Abstracts,Stylized Text Generation: Approaches and Applications,"Mou, Lili, Vechtomova, Olga",2020,https://aclanthology.org/2020.acl-tutorials.5.pdf,https://aclanthology.org/2020.acl-tutorials.5
Proceedings of the 58th Annual Meeting of the Association for Computational Linguistics: Tutorial Abstracts,"Multi-modal Information Extraction from Text, Semi-structured, and Tabular Data on the Web","Dong, Xin Luna, Hajishirzi, Hannaneh, Lockard, Colin, Shiralkar, Prashant",2020,https://aclanthology.org/2020.acl-tutorials.6.pdf,https://aclanthology.org/2020.acl-tutorials.6
Proceedings of the 58th Annual Meeting of the Association for Computational Linguistics: Tutorial Abstracts,Commonsense Reasoning for Natural Language Processing,"Sap, Maarten, Shwartz, Vered, Bosselut, Antoine, Choi, Yejin, Roth, Dan",2020,https://aclanthology.org/2020.acl-tutorials.7.pdf,https://aclanthology.org/2020.acl-tutorials.7
Proceedings of the 58th Annual Meeting of the Association for Computational Linguistics: Tutorial Abstracts,Open-Domain Question Answering,"Chen, Danqi, Yih, Wen-tau",2020,https://aclanthology.org/2020.acl-tutorials.8.pdf,https://aclanthology.org/2020.acl-tutorials.8
Volume Name Not Found,Proceedings of the 1st Workshop on NLP,Authors Not Found,2020,https://aclanthology.org/2020.nlpcovid19-acl.0.pdf,https://aclanthology.org/2020.nlpcovid19-acl.0
Proceedings of the 1st Workshop on NLP,CORD-19,"Wang, Lucy Lu, Lo, Kyle, Chandrasekhar, Yoganand, Reas, Russell, Yang, Jiangjiang, Burdick, Doug, Eide, Darrin, Funk, Kathryn, Katsis, Yannis, Kinney, Rodney Michael, Li, Yunyao, Liu, Ziyang, Merrill, William, Mooney, Paul, Murdick, Dewey A., Rishi, Devvret, Sheehan, Jerry, Shen, Zhihong, Stilson, Brandon, Wade, Alex D., Wang, Kuansan, Wang, Nancy Xin Ru, Wilhelm, Christopher, Xie, Boya, Raymond, Douglas M., Weld, Daniel S., Etzioni, Oren, Kohlmeier, Sebastian",2020,https://aclanthology.org/2020.nlpcovid19-acl.1.pdf,https://aclanthology.org/2020.nlpcovid19-acl.1
Proceedings of the 1st Workshop on NLP,Rapidly Deploying a Neural Search Engine for the COVID-19,"Zhang, Edwin, Gupta, Nikhil, Nogueira, Rodrigo, Cho, Kyunghyun, Lin, Jimmy",2020,https://aclanthology.org/2020.nlpcovid19-acl.2.pdf,https://aclanthology.org/2020.nlpcovid19-acl.2
Proceedings of the 1st Workshop on NLP,Document Classification for COVID-19,"Jim{\'e}nez Guti{\'e}rrez, Bernal, Zeng, Juncheng, Zhang, Dongdong, Zhang, Ping, Su, Yu",2020,https://aclanthology.org/2020.nlpcovid19-acl.3.pdf,https://aclanthology.org/2020.nlpcovid19-acl.3
Proceedings of the 1st Workshop on NLP,Enabling Low-Resource Transfer Learning across COVID-19,"Spangher, Alexander, Peng, Nanyun, May, Jonathan, Ferrara, Emilio",2020,https://aclanthology.org/2020.nlpcovid19-acl.4.pdf,https://aclanthology.org/2020.nlpcovid19-acl.4
Proceedings of the 1st Workshop on NLP,Self-supervised context-aware COVID-19,"Grujicic, Dusan, Radevski, Gorjan, Tuytelaars, Tinne, Blaschko, Matthew",2020,https://aclanthology.org/2020.nlpcovid19-acl.5.pdf,https://aclanthology.org/2020.nlpcovid19-acl.5
Proceedings of the 1st Workshop on NLP,CODA-19,"Huang, Ting-Hao Kenneth, Huang, Chieh-Yang, Ding, Chien-Kuang Cornelia, Hsu, Yen-Chia, Giles, C. Lee",2020,https://aclanthology.org/2020.nlpcovid19-acl.6.pdf,https://aclanthology.org/2020.nlpcovid19-acl.6
Proceedings of the 1st Workshop on NLP,Information Retrieval and Extraction on COVID-19,"Das, Debasmita, Katyal, Yatin, Verma, Janu, Dubey, Shashank, Singh, AakashDeep, Agarwal, Kushagra, Bhaduri, Sourojit, Ranjan, RajeshKumar",2020,https://aclanthology.org/2020.nlpcovid19-acl.7.pdf,https://aclanthology.org/2020.nlpcovid19-acl.7
Proceedings of the 1st Workshop on NLP,What Are People Asking About COVID-19,"Wei, Jerry, Huang, Chengyu, Vosoughi, Soroush, Wei, Jason",2020,https://aclanthology.org/2020.nlpcovid19-acl.8.pdf,https://aclanthology.org/2020.nlpcovid19-acl.8
Proceedings of the 1st Workshop on NLP,Jennifer for COVID-19,"Li, Yunyao, Grandison, Tyrone, Silveyra, Patricia, Douraghy, Ali, Guan, Xinyu, Kieselbach, Thomas, Li, Chengkai, Zhang, Haiqi",2020,https://aclanthology.org/2020.nlpcovid19-acl.9.pdf,https://aclanthology.org/2020.nlpcovid19-acl.9
Proceedings of the 1st Workshop on NLP,A Natural Language Processing System for National COVID-19,"Chapman, Alec, Peterson, Kelly, Turano, Augie, Box, Tam{\'a}ra, Wallace, Katherine, Jones, Makoto",2020,https://aclanthology.org/2020.nlpcovid19-acl.10.pdf,https://aclanthology.org/2020.nlpcovid19-acl.10
Proceedings of the 1st Workshop on NLP,Measuring Emotions,"Kleinberg, Bennett, van der Vegt, Isabelle, Mozes, Maximilian",2020,https://aclanthology.org/2020.nlpcovid19-acl.11.pdf,https://aclanthology.org/2020.nlpcovid19-acl.11
Proceedings of the 1st Workshop on NLP,Estimating the effect of COVID-19,"Wolohan, JT",2020,https://aclanthology.org/2020.nlpcovid19-acl.12.pdf,https://aclanthology.org/2020.nlpcovid19-acl.12
Proceedings of the 1st Workshop on NLP,Exploration of Gender Differences in COVID-19,"Aggarwal, Jai, Rabinovich, Ella, Stevenson, Suzanne",2020,https://aclanthology.org/2020.nlpcovid19-acl.13.pdf,https://aclanthology.org/2020.nlpcovid19-acl.13
Proceedings of the 1st Workshop on NLP,Cross-language sentiment analysis of European,Authors Not Found,2020,https://aclanthology.org/2020.nlpcovid19-acl.14.pdf,https://aclanthology.org/2020.nlpcovid19-acl.14
Proceedings of the 1st Workshop on NLP,Cross-lingual Transfer Learning for COVID-19,"Levy, Sharon, Wang, William Yang",2020,https://aclanthology.org/2020.nlpcovid19-acl.15.pdf,https://aclanthology.org/2020.nlpcovid19-acl.15
Proceedings of the 1st Workshop on NLP,COVID-19,"Alsudias, Lama, Rayson, Paul",2020,https://aclanthology.org/2020.nlpcovid19-acl.16.pdf,https://aclanthology.org/2020.nlpcovid19-acl.16
Proceedings of the 1st Workshop on NLP,NLP,"Medina Serrano, Juan Carlos, Papakyriakopoulos, Orestis, Hegelich, Simon",2020,https://aclanthology.org/2020.nlpcovid19-acl.17.pdf,https://aclanthology.org/2020.nlpcovid19-acl.17
Proceedings of the 1st Workshop on NLP,COVID-QA,Authors Not Found,2020,https://aclanthology.org/2020.nlpcovid19-acl.18.pdf,https://aclanthology.org/2020.nlpcovid19-acl.18
Volume Name Not Found,Proceedings of the First Workshop on Advances in Language and Vision Research,Authors Not Found,2020,https://aclanthology.org/2020.alvr-1.0.pdf,https://aclanthology.org/2020.alvr-1.0
Proceedings of the First Workshop on Advances in Language and Vision Research,Extending I,"Alsudais, Abdulkareem",2020,https://aclanthology.org/2020.alvr-1.1.pdf,https://aclanthology.org/2020.alvr-1.1
Proceedings of the First Workshop on Advances in Language and Vision Research,Toward General Scene Graph: Integration of Visual Semantic Knowledge with Entity Synset Alignment,"Choi, Woo Suk, On, Kyoung-Woon, Heo, Yu-Jung, Zhang, Byoung-Tak",2020,https://aclanthology.org/2020.alvr-1.2.pdf,https://aclanthology.org/2020.alvr-1.2
Proceedings of the First Workshop on Advances in Language and Vision Research,Visual Question Generation from Radiology Images,"Sarrouti, Mourad, Ben Abacha, Asma, Demner-Fushman, Dina",2020,https://aclanthology.org/2020.alvr-1.3.pdf,https://aclanthology.org/2020.alvr-1.3
Proceedings of the First Workshop on Advances in Language and Vision Research,On the role of effective and referring questions in G,"Mazuecos, Mauricio, Testoni, Alberto, Bernardi, Raffaella, Benotti, Luciana",2020,https://aclanthology.org/2020.alvr-1.4.pdf,https://aclanthology.org/2020.alvr-1.4
Proceedings of the First Workshop on Advances in Language and Vision Research,Latent Alignment of Procedural Concepts in Multimodal Recipes,"Rajaby Faghihi, Hossein, Mirzaee, Roshanak, Paliwal, Sudarshan, Kordjamshidi, Parisa",2020,https://aclanthology.org/2020.alvr-1.5.pdf,https://aclanthology.org/2020.alvr-1.5
Volume Name Not Found,Proceedings of the First Workshop on Automatic Simultaneous Translation,Authors Not Found,2020,https://aclanthology.org/2020.autosimtrans-1.0.pdf,https://aclanthology.org/2020.autosimtrans-1.0
Proceedings of the First Workshop on Automatic Simultaneous Translation,Dynamic Sentence Boundary Detection for Simultaneous Translation,"Zhang, Ruiqing, Zhang, Chuanqiang",2020,https://aclanthology.org/2020.autosimtrans-1.1.pdf,https://aclanthology.org/2020.autosimtrans-1.1
Proceedings of the First Workshop on Automatic Simultaneous Translation,End-to-End Speech Translation with Adversarial Training,"Li, Xuancai, Kehai, Chen, Zhao, Tiejun, Yang, Muyun",2020,https://aclanthology.org/2020.autosimtrans-1.2.pdf,https://aclanthology.org/2020.autosimtrans-1.2
Proceedings of the First Workshop on Automatic Simultaneous Translation,Robust Neural Machine Translation with ASR,"Xue, Haiyang, Feng, Yang, Gu, Shuhao, Chen, Wei",2020,https://aclanthology.org/2020.autosimtrans-1.3.pdf,https://aclanthology.org/2020.autosimtrans-1.3
Proceedings of the First Workshop on Automatic Simultaneous Translation,Improving Autoregressive NMT,"Zhou, Long, Zhang, Jiajun, Zong, Chengqing",2020,https://aclanthology.org/2020.autosimtrans-1.4.pdf,https://aclanthology.org/2020.autosimtrans-1.4
Proceedings of the First Workshop on Automatic Simultaneous Translation,Modeling Discourse Structure for Document-level Neural Machine Translation,"Chen, Junxuan, Li, Xiang, Zhang, Jiarui, Zhou, Chulun, Cui, Jianwei, Wang, Bin, Su, Jinsong",2020,https://aclanthology.org/2020.autosimtrans-1.5.pdf,https://aclanthology.org/2020.autosimtrans-1.5
Proceedings of the First Workshop on Automatic Simultaneous Translation,BIT,"Li, Minqin, Cheng, Haodong, Wang, Yuanjie, Zhang, Sijia, Wu, Liting, Guo, Yuhang",2020,https://aclanthology.org/2020.autosimtrans-1.6.pdf,https://aclanthology.org/2020.autosimtrans-1.6
Volume Name Not Found,Proceedings of the Fifteenth Workshop on Innovative Use of NLP for Building Educational Applications,Authors Not Found,2020,https://aclanthology.org/2020.bea-1.0.pdf,https://aclanthology.org/2020.bea-1.0
Proceedings of the Fifteenth Workshop on Innovative Use of NLP for Building Educational Applications,Linguistic Features for Readability Assessment,"Deutsch, Tovly, Jasbi, Masoud, Shieber, Stuart",2020,https://aclanthology.org/2020.bea-1.1.pdf,https://aclanthology.org/2020.bea-1.1
Proceedings of the Fifteenth Workshop on Innovative Use of NLP for Building Educational Applications,Using PRMSE,"Loukina, Anastassia, Madnani, Nitin, Cahill, Aoife, Yao, Lili, Johnson, Matthew S., Riordan, Brian, McCaffrey, Daniel F.",2020,https://aclanthology.org/2020.bea-1.2.pdf,https://aclanthology.org/2020.bea-1.2
Proceedings of the Fifteenth Workshop on Innovative Use of NLP for Building Educational Applications,Multiple Instance Learning for Content Feedback Localization without Annotation,"Hellman, Scott, Murray, William, Wiemerslage, Adam, Rosenstein, Mark, Foltz, Peter, Becker, Lee, Derr, Marcia",2020,https://aclanthology.org/2020.bea-1.3.pdf,https://aclanthology.org/2020.bea-1.3
Proceedings of the Fifteenth Workshop on Innovative Use of NLP for Building Educational Applications,Complementary Systems for Off-Topic Spoken Response Detection,"Raina, Vatsal, Gales, Mark, Knill, Kate",2020,https://aclanthology.org/2020.bea-1.4.pdf,https://aclanthology.org/2020.bea-1.4
Proceedings of the Fifteenth Workshop on Innovative Use of NLP for Building Educational Applications,CIMA,"Stasaski, Katherine, Kao, Kimberly, Hearst, Marti A.",2020,https://aclanthology.org/2020.bea-1.5.pdf,https://aclanthology.org/2020.bea-1.5
Proceedings of the Fifteenth Workshop on Innovative Use of NLP for Building Educational Applications,Becoming Linguistically Mature: Modeling E,Authors Not Found,2020,https://aclanthology.org/2020.bea-1.6.pdf,https://aclanthology.org/2020.bea-1.6
Proceedings of the Fifteenth Workshop on Innovative Use of NLP for Building Educational Applications,Annotation and Classification of Evidence and Reasoning Revisions in Argumentative Writing,"Afrin, Tazin, Wang, Elaine Lin, Litman, Diane, Matsumura, Lindsay Clare, Correnti, Richard",2020,https://aclanthology.org/2020.bea-1.7.pdf,https://aclanthology.org/2020.bea-1.7
Proceedings of the Fifteenth Workshop on Innovative Use of NLP for Building Educational Applications,Can Neural Networks Automatically Score Essay Traits?,"Mathias, Sandeep, Bhattacharyya, Pushpak",2020,https://aclanthology.org/2020.bea-1.8.pdf,https://aclanthology.org/2020.bea-1.8
Proceedings of the Fifteenth Workshop on Innovative Use of NLP for Building Educational Applications,Tracking the Evolution of Written Language Competence in L,"Miaschi, Alessio, Davidson, Sam, Brunato, Dominique, Dell{'}Orletta, Felice, Sagae, Kenji, Sanchez-Gutierrez, Claudia Helena, Venturi, Giulia",2020,https://aclanthology.org/2020.bea-1.9.pdf,https://aclanthology.org/2020.bea-1.9
Proceedings of the Fifteenth Workshop on Innovative Use of NLP for Building Educational Applications,Distractor Analysis and Selection for Multiple-Choice Cloze Questions for Second-Language Learners,"Gao, Lingyu, Gimpel, Kevin, Jensson, Arnar",2020,https://aclanthology.org/2020.bea-1.10.pdf,https://aclanthology.org/2020.bea-1.10
Proceedings of the Fifteenth Workshop on Innovative Use of NLP for Building Educational Applications,Assisting Undergraduate Students in Writing S,"Gonz{\'a}lez-L{\'o}pez, Samuel, Bethard, Steven, Lopez-Lopez, Aurelio",2020,https://aclanthology.org/2020.bea-1.11.pdf,https://aclanthology.org/2020.bea-1.11
Proceedings of the Fifteenth Workshop on Innovative Use of NLP for Building Educational Applications,Applications of Natural Language Processing in Bilingual Language Teaching: An I,"Maxwell-Smith, Zara, Gonz{\'a}lez Ochoa, Sim{\'o}n, Foley, Ben, Suominen, Hanna",2020,https://aclanthology.org/2020.bea-1.12.pdf,https://aclanthology.org/2020.bea-1.12
Proceedings of the Fifteenth Workshop on Innovative Use of NLP for Building Educational Applications,An empirical investigation of neural methods for content scoring of science explanations,"Riordan, Brian, Bichler, Sarah, Bradford, Allison, King Chen, Jennifer, Wiley, Korah, Gerard, Libby, C. Linn, Marcia",2020,https://aclanthology.org/2020.bea-1.13.pdf,https://aclanthology.org/2020.bea-1.13
Proceedings of the Fifteenth Workshop on Innovative Use of NLP for Building Educational Applications,An Exploratory Study of Argumentative Writing by Young Students: A transformer-based Approach,"Ghosh, Debanjan, Beigman Klebanov, Beata, Song, Yi",2020,https://aclanthology.org/2020.bea-1.14.pdf,https://aclanthology.org/2020.bea-1.14
Proceedings of the Fifteenth Workshop on Innovative Use of NLP for Building Educational Applications,Should You Fine-Tune BERT,"Mayfield, Elijah, Black, Alan W",2020,https://aclanthology.org/2020.bea-1.15.pdf,https://aclanthology.org/2020.bea-1.15
Proceedings of the Fifteenth Workshop on Innovative Use of NLP for Building Educational Applications,GECT,"Omelianchuk, Kostiantyn, Atrasevych, Vitaliy, Chernodub, Artem, Skurzhanskyi, Oleksandr",2020,https://aclanthology.org/2020.bea-1.16.pdf,https://aclanthology.org/2020.bea-1.16
Proceedings of the Fifteenth Workshop on Innovative Use of NLP for Building Educational Applications,Interpreting Neural CWI,"Ehara, Yo",2020,https://aclanthology.org/2020.bea-1.17.pdf,https://aclanthology.org/2020.bea-1.17
Proceedings of the Fifteenth Workshop on Innovative Use of NLP for Building Educational Applications,Automated Scoring of Clinical Expressive Language Evaluation Tasks,"Wang, Yiyi, Prud{'}hommeaux, Emily, Asgari, Meysam, Dolata, Jill",2020,https://aclanthology.org/2020.bea-1.18.pdf,https://aclanthology.org/2020.bea-1.18
Proceedings of the Fifteenth Workshop on Innovative Use of NLP for Building Educational Applications,Context-based Automated Scoring of Complex Mathematical Responses,"Cahill, Aoife, Fife, James H, Riordan, Brian, Vajpayee, Avijit, Galochkin, Dmytro",2020,https://aclanthology.org/2020.bea-1.19.pdf,https://aclanthology.org/2020.bea-1.19
Proceedings of the Fifteenth Workshop on Innovative Use of NLP for Building Educational Applications,Predicting the Difficulty and Response Time of Multiple Choice Questions Using Transfer Learning,"Xue, Kang, Yaneva, Victoria, Runyon, Christopher, Baldwin, Peter",2020,https://aclanthology.org/2020.bea-1.20.pdf,https://aclanthology.org/2020.bea-1.20
Proceedings of the Fifteenth Workshop on Innovative Use of NLP for Building Educational Applications,A Comparative Study of Synthetic Data Generation Methods for Grammatical Error Correction,"White, Max, Rozovskaya, Alla",2020,https://aclanthology.org/2020.bea-1.21.pdf,https://aclanthology.org/2020.bea-1.21
Volume Name Not Found,Proceedings of the 19th SIGBioMed Workshop on Biomedical Language Processing,Authors Not Found,2020,https://aclanthology.org/2020.bionlp-1.0.pdf,https://aclanthology.org/2020.bionlp-1.0
Proceedings of the 19th SIGBioMed Workshop on Biomedical Language Processing,Quantifying 60 Years of Gender Bias in Biomedical Research with Word Embeddings,"Rios, Anthony, Joshi, Reenam, Shin, Hejin",2020,https://aclanthology.org/2020.bionlp-1.1.pdf,https://aclanthology.org/2020.bionlp-1.1
Proceedings of the 19th SIGBioMed Workshop on Biomedical Language Processing,Sequence-to-Set Semantic Tagging for Complex Query Reformulation and Automated Text Categorization in Biomedical IR,"Das, Manirupa, Li, Juanxi, Fosler-Lussier, Eric, Lin, Simon, Rust, Steve, Huang, Yungui, Ramnath, Rajiv",2020,https://aclanthology.org/2020.bionlp-1.2.pdf,https://aclanthology.org/2020.bionlp-1.2
Proceedings of the 19th SIGBioMed Workshop on Biomedical Language Processing,Interactive Extractive Search over Biomedical Corpora,"Taub Tabib, Hillel, Shlain, Micah, Sadde, Shoval, Lahav, Dan, Eyal, Matan, Cohen, Yaara, Goldberg, Yoav",2020,https://aclanthology.org/2020.bionlp-1.3.pdf,https://aclanthology.org/2020.bionlp-1.3
Proceedings of the 19th SIGBioMed Workshop on Biomedical Language Processing,Improving Biomedical Analogical Retrieval with Embedding of Structural Dependencies,"Paullada, Amandalynne, Percha, Bethany, Cohen, Trevor",2020,https://aclanthology.org/2020.bionlp-1.4.pdf,https://aclanthology.org/2020.bionlp-1.4
Proceedings of the 19th SIGBioMed Workshop on Biomedical Language Processing,D,"Koroleva, Anna, Kamath, Sanjay, Bossuyt, Patrick, Paroubek, Patrick",2020,https://aclanthology.org/2020.bionlp-1.5.pdf,https://aclanthology.org/2020.bionlp-1.5
Proceedings of the 19th SIGBioMed Workshop on Biomedical Language Processing,Towards Visual Dialog for Radiology,"Kovaleva, Olga, Shivade, Chaitanya, Kashyap, Satyananda, Kanjaria, Karina, Wu, Joy, Ballah, Deddeh, Coy, Adam, Karargyris, Alexandros, Guo, Yufan, Beymer, David Beymer, Rumshisky, Anna, Mukherjee, Vandana Mukherjee",2020,https://aclanthology.org/2020.bionlp-1.6.pdf,https://aclanthology.org/2020.bionlp-1.6
Proceedings of the 19th SIGBioMed Workshop on Biomedical Language Processing,A BERT,"Lin, Chen, Miller, Timothy, Dligach, Dmitriy, Sadeque, Farig, Bethard, Steven, Savova, Guergana",2020,https://aclanthology.org/2020.bionlp-1.7.pdf,https://aclanthology.org/2020.bionlp-1.7
Proceedings of the 19th SIGBioMed Workshop on Biomedical Language Processing,Experimental Evaluation and Development of a Silver-Standard for the MIMIC,"Searle, Thomas, Ibrahim, Zina, Dobson, Richard",2020,https://aclanthology.org/2020.bionlp-1.8.pdf,https://aclanthology.org/2020.bionlp-1.8
Proceedings of the 19th SIGBioMed Workshop on Biomedical Language Processing,Comparative Analysis of Text Classification Approaches in Electronic Health Records,"Mascio, Aurelie, Kraljevic, Zeljko, Bean, Daniel, Dobson, Richard, Stewart, Robert, Bendayan, Rebecca, Roberts, Angus",2020,https://aclanthology.org/2020.bionlp-1.9.pdf,https://aclanthology.org/2020.bionlp-1.9
Proceedings of the 19th SIGBioMed Workshop on Biomedical Language Processing,Noise Pollution in Hospital Readmission Prediction: Long Document Classification with Reinforcement Learning,"Xu, Liyan, Hogan, Julien, Patzer, Rachel E., Choi, Jinho D.",2020,https://aclanthology.org/2020.bionlp-1.10.pdf,https://aclanthology.org/2020.bionlp-1.10
