volume_name,title,authors,year,pdf_link,url
Proceedings of the 58th Annual Meeting of the Association for Computational Linguistics,Bootstrapping Techniques for Polysynthetic Morphological Analysis,"Lane, William, Bird, Steven",2020,https://aclanthology.org/2020.acl-main.594.pdf,https://aclanthology.org/2020.acl-main.594
Proceedings of the 58th Annual Meeting of the Association for Computational Linguistics,Coupling Distant Annotation and Adversarial Training for Cross-Domain C,"Ding, Ning, Long, Dingkun, Xu, Guangwei, Zhu, Muhua, Xie, Pengjun, Wang, Xiaobin, Zheng, Haitao",2020,https://aclanthology.org/2020.acl-main.595.pdf,https://aclanthology.org/2020.acl-main.595
Proceedings of the 58th Annual Meeting of the Association for Computational Linguistics,Modeling Morphological Typology for Unsupervised Learning of Language Morphology,"Xu, Hongzhi, Kodner, Jordan, Marcus, Mitchell, Yang, Charles",2020,https://aclanthology.org/2020.acl-main.596.pdf,https://aclanthology.org/2020.acl-main.596
Proceedings of the 58th Annual Meeting of the Association for Computational Linguistics,Predicting Declension Class from Form and Meaning,"Williams, Adina, Pimentel, Tiago, Blix, Hagen, McCarthy, Arya D., Chodroff, Eleanor, Cotterell, Ryan",2020,https://aclanthology.org/2020.acl-main.597.pdf,https://aclanthology.org/2020.acl-main.597
Proceedings of the 58th Annual Meeting of the Association for Computational Linguistics,Unsupervised Morphological Paradigm Completion,"Jin, Huiming, Cai, Liwei, Peng, Yihui, Xia, Chen, McCarthy, Arya, Kann, Katharina",2020,https://aclanthology.org/2020.acl-main.598.pdf,https://aclanthology.org/2020.acl-main.598
Proceedings of the 58th Annual Meeting of the Association for Computational Linguistics,Document Modeling with Graph Attention Networks for Multi-grained Machine Reading Comprehension,"Zheng, Bo, Wen, Haoyang, Liang, Yaobo, Duan, Nan, Che, Wanxiang, Jiang, Daxin, Zhou, Ming, Liu, Ting",2020,https://aclanthology.org/2020.acl-main.599.pdf,https://aclanthology.org/2020.acl-main.599
Proceedings of the 58th Annual Meeting of the Association for Computational Linguistics,Harvesting and Refining Question-Answer Pairs for Unsupervised QA,"Li, Zhongli, Wang, Wenhui, Dong, Li, Wei, Furu, Xu, Ke",2020,https://aclanthology.org/2020.acl-main.600.pdf,https://aclanthology.org/2020.acl-main.600
Proceedings of the 58th Annual Meeting of the Association for Computational Linguistics,Low-Resource Generation of Multi-hop Reasoning Questions,"Yu, Jianxing, Liu, Wei, Qiu, Shuang, Su, Qinliang, Wang, Kai, Quan, Xiaojun, Yin, Jian",2020,https://aclanthology.org/2020.acl-main.601.pdf,https://aclanthology.org/2020.acl-main.601
Proceedings of the 58th Annual Meeting of the Association for Computational Linguistics,R,"Inoue, Naoya, Stenetorp, Pontus, Inui, Kentaro",2020,https://aclanthology.org/2020.acl-main.602.pdf,https://aclanthology.org/2020.acl-main.602
Proceedings of the 58th Annual Meeting of the Association for Computational Linguistics,Recurrent Chunking Mechanisms for Long-Text Machine Reading Comprehension,"Gong, Hongyu, Shen, Yelong, Yu, Dian, Chen, Jianshu, Yu, Dong",2020,https://aclanthology.org/2020.acl-main.603.pdf,https://aclanthology.org/2020.acl-main.603
Proceedings of the 58th Annual Meeting of the Association for Computational Linguistics,R,"Liu, Dayiheng, Gong, Yeyun, Fu, Jie, Yan, Yu, Chen, Jiusheng, Jiang, Daxin, Lv, Jiancheng, Duan, Nan",2020,https://aclanthology.org/2020.acl-main.604.pdf,https://aclanthology.org/2020.acl-main.604
Proceedings of the 58th Annual Meeting of the Association for Computational Linguistics,Parsing into Variable-in-situ Logico-Semantic Graphs,"Chen, Yufei, Sun, Weiwei",2020,https://aclanthology.org/2020.acl-main.605.pdf,https://aclanthology.org/2020.acl-main.605
Proceedings of the 58th Annual Meeting of the Association for Computational Linguistics,Semantic Parsing for E,"Zhao, Yuanyuan, Sun, Weiwei, Cao, Junjie, Wan, Xiaojun",2020,https://aclanthology.org/2020.acl-main.606.pdf,https://aclanthology.org/2020.acl-main.606
Proceedings of the 58th Annual Meeting of the Association for Computational Linguistics,Semi-Supervised Semantic Dependency Parsing Using CRF,"Jia, Zixia, Ma, Youmi, Cai, Jiong, Tu, Kewei",2020,https://aclanthology.org/2020.acl-main.607.pdf,https://aclanthology.org/2020.acl-main.607
Proceedings of the 58th Annual Meeting of the Association for Computational Linguistics,Unsupervised Dual Paraphrasing for Two-stage Semantic Parsing,"Cao, Ruisheng, Zhu, Su, Yang, Chenyu, Liu, Chen, Ma, Rao, Zhao, Yanbin, Chen, Lu, Yu, Kai",2020,https://aclanthology.org/2020.acl-main.608.pdf,https://aclanthology.org/2020.acl-main.608
Proceedings of the 58th Annual Meeting of the Association for Computational Linguistics,DRTS,"Fu, Qiankun, Zhang, Yue, Liu, Jiangming, Zhang, Meishan",2020,https://aclanthology.org/2020.acl-main.609.pdf,https://aclanthology.org/2020.acl-main.609
Proceedings of the 58th Annual Meeting of the Association for Computational Linguistics,A Two-Stage Masked LM,"Kushilevitz, Guy, Markovitch, Shaul, Goldberg, Yoav",2020,https://aclanthology.org/2020.acl-main.610.pdf,https://aclanthology.org/2020.acl-main.610
Proceedings of the 58th Annual Meeting of the Association for Computational Linguistics,FLAT,"Li, Xiaonan, Yan, Hang, Qiu, Xipeng, Huang, Xuanjing",2020,https://aclanthology.org/2020.acl-main.611.pdf,https://aclanthology.org/2020.acl-main.611
Proceedings of the 58th Annual Meeting of the Association for Computational Linguistics,Improving Entity Linking through Semantic Reinforced Entity Embeddings,"Hou, Feng, Wang, Ruili, He, Jun, Zhou, Yi",2020,https://aclanthology.org/2020.acl-main.612.pdf,https://aclanthology.org/2020.acl-main.612
Proceedings of the 58th Annual Meeting of the Association for Computational Linguistics,Document Translation vs. Query Translation for Cross-Lingual Information Retrieval in the Medical Domain,"Saleh, Shadi, Pecina, Pavel",2020,https://aclanthology.org/2020.acl-main.613.pdf,https://aclanthology.org/2020.acl-main.613
Proceedings of the 58th Annual Meeting of the Association for Computational Linguistics,Learning Robust Models for e-Commerce Product Search,"Nguyen, Thanh, Rao, Nikhil, Subbian, Karthik",2020,https://aclanthology.org/2020.acl-main.614.pdf,https://aclanthology.org/2020.acl-main.614
Proceedings of the 58th Annual Meeting of the Association for Computational Linguistics,Generalized Entropy Regularization or: There`s Nothing Special about Label Smoothing,"Meister, Clara, Salesky, Elizabeth, Cotterell, Ryan",2020,https://aclanthology.org/2020.acl-main.615.pdf,https://aclanthology.org/2020.acl-main.615
Proceedings of the 58th Annual Meeting of the Association for Computational Linguistics,Highway Transformer: Self-Gating Enhanced Self-Attentive Networks,"Chai, Yekun, Jin, Shuo, Hou, Xinwen",2020,https://aclanthology.org/2020.acl-main.616.pdf,https://aclanthology.org/2020.acl-main.616
Proceedings of the 58th Annual Meeting of the Association for Computational Linguistics,Low-Dimensional Hyperbolic Knowledge Graph Embeddings,"Chami, Ines, Wolf, Adva, Juan, Da-Cheng, Sala, Frederic, Ravi, Sujith, R{\'e}, Christopher",2020,https://aclanthology.org/2020.acl-main.617.pdf,https://aclanthology.org/2020.acl-main.617
Proceedings of the 58th Annual Meeting of the Association for Computational Linguistics,Classification-Based Self-Learning for Weakly Supervised Bilingual Lexicon Induction,"Karan, Vanja Mladen, Vuli{\'c}, Ivan, Korhonen, Anna, Glava{\v{s}}, Goran",2020,https://aclanthology.org/2020.acl-main.618.pdf,https://aclanthology.org/2020.acl-main.618
Proceedings of the 58th Annual Meeting of the Association for Computational Linguistics,Gender in Danger? Evaluating Speech Translation Technology on the M,"Bentivogli, Luisa, Savoldi, Beatrice, Negri, Matteo, Di Gangi, Mattia A., Cattoni, Roldano, Turchi, Marco",2020,https://aclanthology.org/2020.acl-main.619.pdf,https://aclanthology.org/2020.acl-main.619
Proceedings of the 58th Annual Meeting of the Association for Computational Linguistics,Uncertainty-Aware Curriculum Learning for Neural Machine Translation,"Zhou, Yikai, Yang, Baosong, Wong, Derek F., Wan, Yu, Chao, Lidia S.",2020,https://aclanthology.org/2020.acl-main.620.pdf,https://aclanthology.org/2020.acl-main.620
Proceedings of the 58th Annual Meeting of the Association for Computational Linguistics,Closing the Gap: Joint De-Identification and Concept Extraction in the Clinical Domain,Authors Not Found,2020,https://aclanthology.org/2020.acl-main.621.pdf,https://aclanthology.org/2020.acl-main.621
Proceedings of the 58th Annual Meeting of the Association for Computational Linguistics,C,"Wu, Wei, Wang, Fei, Yuan, Arianna, Wu, Fei, Li, Jiwei",2020,https://aclanthology.org/2020.acl-main.622.pdf,https://aclanthology.org/2020.acl-main.622
Proceedings of the 58th Annual Meeting of the Association for Computational Linguistics,Estimating predictive uncertainty for rumour verification models,"Kochkina, Elena, Liakata, Maria",2020,https://aclanthology.org/2020.acl-main.623.pdf,https://aclanthology.org/2020.acl-main.623
Proceedings of the 58th Annual Meeting of the Association for Computational Linguistics,F,"Klie, Jan-Christoph, Eckart de Castilho, Richard, Gurevych, Iryna",2020,https://aclanthology.org/2020.acl-main.624.pdf,https://aclanthology.org/2020.acl-main.624
Proceedings of the 58th Annual Meeting of the Association for Computational Linguistics,Language to Network: Conditional Parameter Adaptation with Natural Language Descriptions,"Jin, Tian, Liu, Zhun, Yan, Shengjia, Eichenberger, Alexandre, Morency, Louis-Philippe",2020,https://aclanthology.org/2020.acl-main.625.pdf,https://aclanthology.org/2020.acl-main.625
Proceedings of the 58th Annual Meeting of the Association for Computational Linguistics,Controlled Crowdsourcing for High-Quality QA,"Roit, Paul, Klein, Ayal, Stepanov, Daniela, Mamou, Jonathan, Michael, Julian, Stanovsky, Gabriel, Zettlemoyer, Luke, Dagan, Ido",2020,https://aclanthology.org/2020.acl-main.626.pdf,https://aclanthology.org/2020.acl-main.626
Proceedings of the 58th Annual Meeting of the Association for Computational Linguistics,Cross-Lingual Semantic Role Labeling with High-Quality Translated Training Corpus,"Fei, Hao, Zhang, Meishan, Ji, Donghong",2020,https://aclanthology.org/2020.acl-main.627.pdf,https://aclanthology.org/2020.acl-main.627
Proceedings of the 58th Annual Meeting of the Association for Computational Linguistics,Sentence Meta-Embeddings for Unsupervised Semantic Textual Similarity,Authors Not Found,2020,https://aclanthology.org/2020.acl-main.628.pdf,https://aclanthology.org/2020.acl-main.628
Proceedings of the 58th Annual Meeting of the Association for Computational Linguistics,Transition-based Semantic Dependency Parsing with Pointer Networks,"Fern{\'a}ndez-Gonz{\'a}lez, Daniel, G{\'o}mez-Rodr{\'i}guez, Carlos",2020,https://aclanthology.org/2020.acl-main.629.pdf,https://aclanthology.org/2020.acl-main.629
Proceedings of the 58th Annual Meeting of the Association for Computational Linguistics,tBERT,"Peinelt, Nicole, Nguyen, Dong, Liakata, Maria",2020,https://aclanthology.org/2020.acl-main.630.pdf,https://aclanthology.org/2020.acl-main.630
Proceedings of the 58th Annual Meeting of the Association for Computational Linguistics,Conditional Augmentation for Aspect Term Extraction via Masked Sequence-to-Sequence Generation,"Li, Kun, Chen, Chengbo, Quan, Xiaojun, Ling, Qing, Song, Yan",2020,https://aclanthology.org/2020.acl-main.631.pdf,https://aclanthology.org/2020.acl-main.631
Proceedings of the 58th Annual Meeting of the Association for Computational Linguistics,Exploiting Personal Characteristics of Debaters for Predicting Persuasiveness,Authors Not Found,2020,https://aclanthology.org/2020.acl-main.632.pdf,https://aclanthology.org/2020.acl-main.632
Proceedings of the 58th Annual Meeting of the Association for Computational Linguistics,Out of the Echo Chamber: D,"Orbach, Matan, Bilu, Yonatan, Toledo, Assaf, Lahav, Dan, Jacovi, Michal, Aharonov, Ranit, Slonim, Noam",2020,https://aclanthology.org/2020.acl-main.633.pdf,https://aclanthology.org/2020.acl-main.633
Proceedings of the 58th Annual Meeting of the Association for Computational Linguistics,Diversifying Dialogue Generation with Non-Conversational Text,"Su, Hui, Shen, Xiaoyu, Zhao, Sanqiang, Xiao, Zhou, Hu, Pengwei, Zhong, Randy, Niu, Cheng, Zhou, Jie",2020,https://aclanthology.org/2020.acl-main.634.pdf,https://aclanthology.org/2020.acl-main.634
Proceedings of the 58th Annual Meeting of the Association for Computational Linguistics,K,"Zhou, Hao, Zheng, Chujie, Huang, Kaili, Huang, Minlie, Zhu, Xiaoyan",2020,https://aclanthology.org/2020.acl-main.635.pdf,https://aclanthology.org/2020.acl-main.635
Proceedings of the 58th Annual Meeting of the Association for Computational Linguistics,Meta-Reinforced Multi-Domain State Generator for Dialogue Systems,"Huang, Yi, Feng, Junlan, Hu, Min, Wu, Xiaoting, Du, Xiaoyu, Ma, Shuo",2020,https://aclanthology.org/2020.acl-main.636.pdf,https://aclanthology.org/2020.acl-main.636
Proceedings of the 58th Annual Meeting of the Association for Computational Linguistics,Modeling Long Context for Task-Oriented Dialogue State Generation,"Quan, Jun, Xiong, Deyi",2020,https://aclanthology.org/2020.acl-main.637.pdf,https://aclanthology.org/2020.acl-main.637
Proceedings of the 58th Annual Meeting of the Association for Computational Linguistics,Multi-Domain Dialogue Acts and Response Co-Generation,"Wang, Kai, Tian, Junfeng, Wang, Rui, Quan, Xiaojun, Yu, Jianxing",2020,https://aclanthology.org/2020.acl-main.638.pdf,https://aclanthology.org/2020.acl-main.638
Proceedings of the 58th Annual Meeting of the Association for Computational Linguistics,Exploring Contextual Word-level Style Relevance for Unsupervised Style Transfer,"Zhou, Chulun, Chen, Liangyu, Liu, Jiachen, Xiao, Xinyan, Su, Jinsong, Guo, Sheng, Wu, Hua",2020,https://aclanthology.org/2020.acl-main.639.pdf,https://aclanthology.org/2020.acl-main.639
Proceedings of the 58th Annual Meeting of the Association for Computational Linguistics,Heterogeneous Graph Transformer for Graph-to-Sequence Learning,"Yao, Shaowei, Wang, Tianming, Wan, Xiaojun",2020,https://aclanthology.org/2020.acl-main.640.pdf,https://aclanthology.org/2020.acl-main.640
Proceedings of the 58th Annual Meeting of the Association for Computational Linguistics,Neural Data-to-Text Generation via Jointly Learning the Segmentation and Correspondence,"Shen, Xiaoyu, Chang, Ernie, Su, Hui, Niu, Cheng, Klakow, Dietrich",2020,https://aclanthology.org/2020.acl-main.641.pdf,https://aclanthology.org/2020.acl-main.641
Proceedings of the 58th Annual Meeting of the Association for Computational Linguistics,Aligned Dual Channel Graph Convolutional Network for Visual Question Answering,"Huang, Qingbao, Wei, Jielong, Cai, Yi, Zheng, Changmeng, Chen, Junying, Leung, Ho-fung, Li, Qing",2020,https://aclanthology.org/2020.acl-main.642.pdf,https://aclanthology.org/2020.acl-main.642
Proceedings of the 58th Annual Meeting of the Association for Computational Linguistics,Multimodal Neural Graph Memory Networks for Visual Question Answering,"Khademi, Mahmoud",2020,https://aclanthology.org/2020.acl-main.643.pdf,https://aclanthology.org/2020.acl-main.643
Proceedings of the 58th Annual Meeting of the Association for Computational Linguistics,Refer360$^\circ,"Cirik, Volkan, Berg-Kirkpatrick, Taylor, Morency, Louis-Philippe",2020,https://aclanthology.org/2020.acl-main.644.pdf,https://aclanthology.org/2020.acl-main.644
Proceedings of the 58th Annual Meeting of the Association for Computational Linguistics,C,"Martin, Louis, Muller, Benjamin, Ortiz Su{\'a}rez, Pedro Javier, Dupont, Yoann, Romary, Laurent, de la Clergerie, {\'E}ric, Seddah, Djam{\'e}, Sagot, Beno{\^i}t",2020,https://aclanthology.org/2020.acl-main.645.pdf,https://aclanthology.org/2020.acl-main.645
Proceedings of the 58th Annual Meeting of the Association for Computational Linguistics,Effective Estimation of Deep Generative Language Models,"Pelsmaeker, Tom, Aziz, Wilker",2020,https://aclanthology.org/2020.acl-main.646.pdf,https://aclanthology.org/2020.acl-main.646
Proceedings of the 58th Annual Meeting of the Association for Computational Linguistics,Null It Out: Guarding Protected Attributes by Iterative Nullspace Projection,"Ravfogel, Shauli, Elazar, Yanai, Gonen, Hila, Twiton, Michael, Goldberg, Yoav",2020,https://aclanthology.org/2020.acl-main.647.pdf,https://aclanthology.org/2020.acl-main.647
Proceedings of the 58th Annual Meeting of the Association for Computational Linguistics,2kenize: Tying Subword Sequences for C,"A, Pranav, Augenstein, Isabelle",2020,https://aclanthology.org/2020.acl-main.648.pdf,https://aclanthology.org/2020.acl-main.648
Proceedings of the 58th Annual Meeting of the Association for Computational Linguistics,Predicting the Growth of Morphological Families from Social and Linguistic Factors,Authors Not Found,2020,https://aclanthology.org/2020.acl-main.649.pdf,https://aclanthology.org/2020.acl-main.649
Proceedings of the 58th Annual Meeting of the Association for Computational Linguistics,Semi-supervised Contextual Historical Text Normalization,"Makarov, Peter, Clematide, Simon",2020,https://aclanthology.org/2020.acl-main.650.pdf,https://aclanthology.org/2020.acl-main.650
Proceedings of the 58th Annual Meeting of the Association for Computational Linguistics,C,"Kumar, Vaibhav, Black, Alan W",2020,https://aclanthology.org/2020.acl-main.651.pdf,https://aclanthology.org/2020.acl-main.651
Proceedings of the 58th Annual Meeting of the Association for Computational Linguistics,D,"Campos, Jon Ander, Otegi, Arantxa, Soroa, Aitor, Deriu, Jan, Cieliebak, Mark, Agirre, Eneko",2020,https://aclanthology.org/2020.acl-main.652.pdf,https://aclanthology.org/2020.acl-main.652
Proceedings of the 58th Annual Meeting of the Association for Computational Linguistics,MLQA,"Lewis, Patrick, Oguz, Barlas, Rinott, Ruty, Riedel, Sebastian, Schwenk, Holger",2020,https://aclanthology.org/2020.acl-main.653.pdf,https://aclanthology.org/2020.acl-main.653
Proceedings of the 58th Annual Meeting of the Association for Computational Linguistics,Multi-source Meta Transfer for Low Resource Multiple-Choice Question Answering,"Yan, Ming, Zhang, Hao, Jin, Di, Zhou, Joey Tianyi",2020,https://aclanthology.org/2020.acl-main.654.pdf,https://aclanthology.org/2020.acl-main.654
Proceedings of the 58th Annual Meeting of the Association for Computational Linguistics,Fine-grained Fact Verification with Kernel Graph Attention Network,"Liu, Zhenghao, Xiong, Chenyan, Sun, Maosong, Liu, Zhiyuan",2020,https://aclanthology.org/2020.acl-main.655.pdf,https://aclanthology.org/2020.acl-main.655
Proceedings of the 58th Annual Meeting of the Association for Computational Linguistics,Generating Fact Checking Explanations,"Atanasova, Pepa, Simonsen, Jakob Grue, Lioma, Christina, Augenstein, Isabelle",2020,https://aclanthology.org/2020.acl-main.656.pdf,https://aclanthology.org/2020.acl-main.656
Proceedings of the 58th Annual Meeting of the Association for Computational Linguistics,Premise Selection in Natural Language Mathematical Texts,"Ferreira, Deborah, Freitas, Andr{\'e}",2020,https://aclanthology.org/2020.acl-main.657.pdf,https://aclanthology.org/2020.acl-main.657
Proceedings of the 58th Annual Meeting of the Association for Computational Linguistics,A Call for More Rigor in Unsupervised Cross-lingual Learning,"Artetxe, Mikel, Ruder, Sebastian, Yogatama, Dani, Labaka, Gorka, Agirre, Eneko",2020,https://aclanthology.org/2020.acl-main.658.pdf,https://aclanthology.org/2020.acl-main.658
Proceedings of the 58th Annual Meeting of the Association for Computational Linguistics,A Tale of a Probe and a Parser,"Maudslay, Rowan Hall, Valvoda, Josef, Pimentel, Tiago, Williams, Adina, Cotterell, Ryan",2020,https://aclanthology.org/2020.acl-main.659.pdf,https://aclanthology.org/2020.acl-main.659
Proceedings of the 58th Annual Meeting of the Association for Computational Linguistics,From SPMRL,"Tsarfaty, Reut, Bareket, Dan, Klein, Stav, Seker, Amit",2020,https://aclanthology.org/2020.acl-main.660.pdf,https://aclanthology.org/2020.acl-main.660
Proceedings of the 58th Annual Meeting of the Association for Computational Linguistics,Speech Translation and the End-to-End Promise: Taking Stock of Where We Are,"Sperber, Matthias, Paulik, Matthias",2020,https://aclanthology.org/2020.acl-main.661.pdf,https://aclanthology.org/2020.acl-main.661
Proceedings of the 58th Annual Meeting of the Association for Computational Linguistics,What Question Answering can Learn from Trivia Nerds,Authors Not Found,2020,https://aclanthology.org/2020.acl-main.662.pdf,https://aclanthology.org/2020.acl-main.662
Proceedings of the 58th Annual Meeting of the Association for Computational Linguistics,What are the Goals of Distributional Semantics?,"Emerson, Guy",2020,https://aclanthology.org/2020.acl-main.663.pdf,https://aclanthology.org/2020.acl-main.663
Proceedings of the 58th Annual Meeting of the Association for Computational Linguistics,Improving Image Captioning with Better Use of Caption,"Shi, Zhan, Zhou, Xu, Qiu, Xipeng, Zhu, Xiaodan",2020,https://aclanthology.org/2020.acl-main.664.pdf,https://aclanthology.org/2020.acl-main.664
Proceedings of the 58th Annual Meeting of the Association for Computational Linguistics,S,"Elder, Henry, Burke, Robert, O{'}Connor, Alexander, Foster, Jennifer",2020,https://aclanthology.org/2020.acl-main.665.pdf,https://aclanthology.org/2020.acl-main.665
Proceedings of the 58th Annual Meeting of the Association for Computational Linguistics,Toward Better Storylines with Sentence-Level Language Models,"Ippolito, Daphne, Grangier, David, Eck, Douglas, Callison-Burch, Chris",2020,https://aclanthology.org/2020.acl-main.666.pdf,https://aclanthology.org/2020.acl-main.666
Proceedings of the 58th Annual Meeting of the Association for Computational Linguistics,A Two-Step Approach for Implicit Event Argument Detection,"Zhang, Zhisong, Kong, Xiang, Liu, Zhengzhong, Ma, Xuezhe, Hovy, Eduard",2020,https://aclanthology.org/2020.acl-main.667.pdf,https://aclanthology.org/2020.acl-main.667
Proceedings of the 58th Annual Meeting of the Association for Computational Linguistics,Machine Reading of Historical Events,"Honovich, Or, Torroba Hennigen, Lucas, Abend, Omri, Cohen, Shay B.",2020,https://aclanthology.org/2020.acl-main.668.pdf,https://aclanthology.org/2020.acl-main.668
Proceedings of the 58th Annual Meeting of the Association for Computational Linguistics,Revisiting Unsupervised Relation Extraction,"Tran, Thy Thy, Le, Phong, Ananiadou, Sophia",2020,https://aclanthology.org/2020.acl-main.669.pdf,https://aclanthology.org/2020.acl-main.669
Proceedings of the 58th Annual Meeting of the Association for Computational Linguistics,S,"Jain, Sarthak, van Zuylen, Madeleine, Hajishirzi, Hannaneh, Beltagy, Iz",2020,https://aclanthology.org/2020.acl-main.670.pdf,https://aclanthology.org/2020.acl-main.670
Proceedings of the 58th Annual Meeting of the Association for Computational Linguistics,Contrastive Self-Supervised Learning for Commonsense Reasoning,"Klein, Tassilo, Nabi, Moin",2020,https://aclanthology.org/2020.acl-main.671.pdf,https://aclanthology.org/2020.acl-main.671
Proceedings of the 58th Annual Meeting of the Association for Computational Linguistics,Do Transformers Need Deep Long-Range Memory?,"Rae, Jack, Razavi, Ali",2020,https://aclanthology.org/2020.acl-main.672.pdf,https://aclanthology.org/2020.acl-main.672
Proceedings of the 58th Annual Meeting of the Association for Computational Linguistics,Improving Disentangled Text Representation Learning with Information-Theoretic Guidance,"Cheng, Pengyu, Min, Martin Renqiang, Shen, Dinghan, Malon, Christopher, Zhang, Yizhe, Li, Yitong, Carin, Lawrence",2020,https://aclanthology.org/2020.acl-main.673.pdf,https://aclanthology.org/2020.acl-main.673
Proceedings of the 58th Annual Meeting of the Association for Computational Linguistics,Understanding Advertisements with BERT,"Kalra, Kanika, Kurma, Bhargav, Vadakkeeveetil Sreelatha, Silpa, Patwardhan, Manasi, Karande, Shirish",2020,https://aclanthology.org/2020.acl-main.674.pdf,https://aclanthology.org/2020.acl-main.674
Proceedings of the 58th Annual Meeting of the Association for Computational Linguistics,Non-Linear Instance-Based Cross-Lingual Mapping for Non-Isomorphic Embedding Spaces,"Glava{\v{s}}, Goran, Vuli{\'c}, Ivan",2020,https://aclanthology.org/2020.acl-main.675.pdf,https://aclanthology.org/2020.acl-main.675
Proceedings of the 58th Annual Meeting of the Association for Computational Linguistics,Good-Enough Compositional Data Augmentation,"Andreas, Jacob",2020,https://aclanthology.org/2020.acl-main.676.pdf,https://aclanthology.org/2020.acl-main.676
Proceedings of the 58th Annual Meeting of the Association for Computational Linguistics,RAT-SQL,"Wang, Bailin, Shin, Richard, Liu, Xiaodong, Polozov, Oleksandr, Richardson, Matthew",2020,https://aclanthology.org/2020.acl-main.677.pdf,https://aclanthology.org/2020.acl-main.677
Proceedings of the 58th Annual Meeting of the Association for Computational Linguistics,Temporal Common Sense Acquisition with Minimal Supervision,"Zhou, Ben, Ning, Qiang, Khashabi, Daniel, Roth, Dan",2020,https://aclanthology.org/2020.acl-main.678.pdf,https://aclanthology.org/2020.acl-main.678
Proceedings of the 58th Annual Meeting of the Association for Computational Linguistics,The Sensitivity of Language Models and Humans to W,"Abdou, Mostafa, Ravishankar, Vinit, Barrett, Maria, Belinkov, Yonatan, Elliott, Desmond, S{\o}gaard, Anders",2020,https://aclanthology.org/2020.acl-main.679.pdf,https://aclanthology.org/2020.acl-main.679
Proceedings of the 58th Annual Meeting of the Association for Computational Linguistics,Temporally-Informed Analysis of Named Entity Recognition,"Rijhwani, Shruti, Preotiuc-Pietro, Daniel",2020,https://aclanthology.org/2020.acl-main.680.pdf,https://aclanthology.org/2020.acl-main.680
